{
  "$schema": "https://json-schema.org/draft/2020-12/schema",
  "$id": "https://github.com/joalavedra/insurer/src/insurer/agentrisk/schemas/agent-evidence.v1.schema.json",
  "title": "Agent Risk normalized evidence v1",
  "type": "object",
  "additionalProperties": false,
  "required": [
    "version",
    "tool_calls",
    "guardrail_checks",
    "warnings",
    "exam_results",
    "ci_eval_results",
    "exam_present",
    "inputs"
  ],
  "properties": {
    "version": { "const": "agent-evidence.v1" },
    "tool_calls": {
      "type": "array",
      "items": { "$ref": "#/$defs/toolCall" }
    },
    "guardrail_checks": {
      "type": "array",
      "items": { "$ref": "#/$defs/guardrailCheck" }
    },
    "warnings": { "type": "integer" },
    "exam_results": {
      "type": "array",
      "items": { "$ref": "#/$defs/examCaseResult" }
    },
    "ci_eval_results": {
      "type": "array",
      "items": { "$ref": "#/$defs/ciEvalCaseResult" }
    },
    "exam_present": { "type": "boolean" },
    "inputs": { "$ref": "#/$defs/inputs" }
  },
  "$defs": {
    "evidenceInput": {
      "type": "object",
      "additionalProperties": false,
      "required": ["path", "sha256"],
      "properties": {
        "path": { "type": "string" },
        "sha256": {
          "type": "string",
          "pattern": "^[0-9a-f]{64}$"
        }
      }
    },
    "inputs": {
      "type": "object",
      "additionalProperties": false,
      "required": ["manifest", "traces", "exam_results", "ci_evals"],
      "properties": {
        "manifest": { "$ref": "#/$defs/evidenceInput" },
        "traces": {
          "type": "array",
          "items": { "$ref": "#/$defs/evidenceInput" }
        },
        "exam_results": {
          "oneOf": [
            { "$ref": "#/$defs/evidenceInput" },
            { "type": "null" }
          ]
        },
        "ci_evals": {
          "type": "array",
          "items": { "$ref": "#/$defs/evidenceInput" }
        }
      }
    },
    "toolCall": {
      "type": "object",
      "additionalProperties": false,
      "required": [
        "trace_id",
        "span_id",
        "parent_span_id",
        "start_ns",
        "agent",
        "tool",
        "args",
        "result",
        "error",
        "convention",
        "end_ns"
      ],
      "properties": {
        "trace_id": { "type": "string" },
        "span_id": { "type": "string" },
        "parent_span_id": {
          "type": ["string", "null"]
        },
        "start_ns": { "type": "integer" },
        "agent": { "type": "string" },
        "tool": { "type": "string" },
        "args": {
          "type": "object",
          "additionalProperties": true
        },
        "result": {
          "type": ["string", "null"]
        },
        "error": { "type": "boolean" },
        "convention": {
          "enum": ["gen_ai", "openinference"]
        },
        "end_ns": { "type": "integer" }
      }
    },
    "guardrailCheck": {
      "type": "object",
      "additionalProperties": false,
      "required": ["trace_id", "kind", "passed", "start_ns"],
      "properties": {
        "trace_id": { "type": "string" },
        "kind": {
          "enum": ["input", "output"]
        },
        "passed": { "type": "boolean" },
        "start_ns": { "type": "integer" }
      }
    },
    "examCaseResult": {
      "type": "object",
      "additionalProperties": false,
      "required": ["case_id", "peril", "passed", "metadata"],
      "properties": {
        "case_id": { "type": "string" },
        "peril": { "type": "string" },
        "passed": { "type": "boolean" },
        "metadata": {
          "type": "object",
          "required": ["battery", "battery_sha256"],
          "properties": {
            "battery": { "type": "string" },
            "battery_sha256": { "type": "string" }
          },
          "additionalProperties": true
        }
      }
    },
    "ciEvalCaseResult": {
      "type": "object",
      "additionalProperties": false,
      "required": ["case_id", "peril", "passed", "metadata"],
      "properties": {
        "case_id": { "type": "string" },
        "peril": { "type": "string" },
        "passed": { "type": "boolean" },
        "metadata": {
          "type": "object",
          "additionalProperties": true
        }
      }
    }
  }
}
